{
  "$schema": "http://json-schema.org/draft-07/schema#",
  "$id": "https://promenade.dev/schema/room.schema.json",
  "title": "Room",
  "description": "A Promenade room: one splat world you can walk, plus the entryways you arrive at, the exits you leave through, and the artifacts you open. A museum is just rooms linked by exits — there is no manifest. Asset URLs resolve relative to this file's URL.",
  "type": "object",
  "required": ["display_name", "splat_url", "collider_url", "calibration"],
  "additionalProperties": false,
  "properties": {
    "$schema": { "type": "string", "description": "Path/URL to this schema (editor autocomplete only; ignored by the viewer)." },
    "display_name": { "type": "string", "description": "Human name shown in the HUD, e.g. \"Library\"." },
    "splat_url": { "type": "string", "description": "Gaussian-splat world (.spz/.ply). Resolved relative to this file." },
    "collider_url": { "type": "string", "description": "GLB collider mesh for wall/floor physics. Resolved relative to this file." },
    "music_url": { "type": ["string", "null"], "description": "Optional loopable background track." },
    "pano_url": { "type": ["string", "null"], "description": "Optional equirectangular panorama." },
    "thumbnail_url": { "type": ["string", "null"], "description": "Optional preview image." },
    "calibration": {
      "type": "object",
      "description": "Marble reconstructs at an arbitrary scale; this brings the room to meters.",
      "required": ["scale"],
      "additionalProperties": false,
      "properties": { "scale": { "type": "number", "exclusiveMinimum": 0 } }
    },
    "entryways": {
      "type": "array",
      "description": "Named spawn spots. One should be id \"default\" (the no-fragment spawn).",
      "items": {
        "type": "object",
        "required": ["id", "pos", "yaw"],
        "additionalProperties": false,
        "properties": {
          "id": { "type": "string", "description": "Stable id; URL fragments link to it (/library/#from-study). Renaming rots links." },
          "pos": { "$ref": "#/$defs/vec3" },
          "yaw": { "type": "number", "description": "Facing direction in degrees on arrival." }
        }
      }
    },
    "exits": {
      "type": "array",
      "description": "Walk up + press E to follow `to`. Dead links 404 by design.",
      "items": {
        "type": "object",
        "required": ["pos", "to"],
        "additionalProperties": false,
        "properties": {
          "pos": { "$ref": "#/$defs/vec3" },
          "radius": { "type": "number", "exclusiveMinimum": 0, "default": 1.3, "description": "Trigger radius in meters." },
          "to": { "type": "string", "description": "Destination URL + #entryway. Relative within a site (../study/#from-library), absolute across sites." }
        }
      }
    },
    "artifacts": {
      "type": "array",
      "description": "Walk up + interact to open `url` in a fullscreen overlay (no travel).",
      "items": {
        "type": "object",
        "required": ["pos", "radius", "url"],
        "additionalProperties": false,
        "properties": {
          "id": { "type": "string" },
          "pos": { "$ref": "#/$defs/vec3" },
          "radius": { "type": "number", "exclusiveMinimum": 0 },
          "url": { "type": "string", "description": "Web URL opened in the overlay." }
        }
      }
    }
  },
  "$defs": {
    "vec3": {
      "type": "array",
      "description": "[x, y, z] in meters, world space.",
      "items": { "type": "number" },
      "minItems": 3,
      "maxItems": 3
    }
  }
}
