{
  "display_name": "Study Room",
  "splat_url": "/worlds/studyroom.spz",
  "collider_url": "/worlds/studyroom_collider.glb",
  "pano_url": "/worlds/studyroom_pano.png",
  "thumbnail_url": "/worlds/studyroom.webp",
  "music_url": "/music/Sunset_Focus.mp3",
  "calibration": { "scale": 1.0 },
  "entryways": [
    { "id": "default", "pos": [0.02, -0.11, 1.75], "yaw": 0.11 },
    { "id": "from-library", "pos": [0.02, -0.11, 1.75], "yaw": 0.11 }
  ],
  "exits": [
    { "pos": [0.02, -0.11, 1.75], "radius": 1.3, "to": "./library#from-study" }
  ],
  "artifacts": []
}
