{
  "display_name": "Library",
  "splat_url": "/worlds/library.spz",
  "collider_url": "/worlds/library_collider.glb",
  "pano_url": "/worlds/library_pano.png",
  "thumbnail_url": "/worlds/library_thumb.webp",
  "music_url": "/music/Sunlit_Grove_Ambient.mp3",
  "calibration": { "scale": 1.0 },
  "entryways": [
    { "id": "default", "pos": [0.02, -0.11, 1.75], "yaw": -179.89 },
    { "id": "from-study", "pos": [0.02, -0.11, 1.75], "yaw": -179.89 }
  ],
  "exits": [
    { "pos": [0.02, -0.11, 1.75], "radius": 1.3, "to": "./study#from-library" }
  ],
  "artifacts": []
}
