{
  "display_name": "Library",
  "splat_url": "/worlds/library.spz",
  "collider_url": "/worlds/library_collider.glb",
  "thumbnail_url": "/worlds/library_thumb.webp",
  "music_url": "/music/Sunlit_Grove_Ambient.mp3",
  "calibration": { "scale": 1.0 },
  "entryways": [
    { "id": "default", "pos": [0.93, -0.18, 0.46], "yaw": -134.21 },
    { "id": "from-study", "pos": [0.93, -0.18, 0.46], "yaw": -134.21 }
  ],
  "exits": [
    { "pos": [0.93, -0.18, 0.46], "radius": 1.3, "to": "../study/#from-library" }
  ],
  "artifacts": [
    { "id": "lamp", "pos": [0.03, -0.4, -1.44], "radius": 1.0, "url": "https://julian.dance" }
  ]
}
